{
  "id": "first_shift",
  "label": "s32_anchor_first_shift",
  "title": "First Shift in the Archive",
  "order": 2,
  "phase": "normal",
  "requirements": [
    "anchor_done(arrival)"
  ],
  "effects": [
    "event(first_shift)",
    "anchor_done(first_shift)",
    "flag archive_visits += 1"
  ],
  "summary": "First real work in the archive room. Introduces the cataloguing loop and the cast around it. Still no anomaly.",
  "outcomes": [
    [
      "trait curious += 1",
      "rel iris->player.trust += 4",
      "rel iris->player.familiarity += 3"
    ],
    [
      "trait reserved += 1",
      "rel iris->player.familiarity += 3"
    ],
    [
      "trait empathetic += 1",
      "rel iris->player.trust += 5",
      "rel iris->player.attraction += 2"
    ]
  ]
}
